{
  "schema_version": 1,
  "decision_id": "D-20260812-039",
  "title": "T-038意大利2位核心人物确认",
  "status": "confirmed",
  "confirmed_by": "user",
  "confirmed_at": "2026-08-12T17:30:00Z",
  "scope": [
    "T-038",
    "character_design"
  ],
  "decisions": [
    "意大利 2 位核心人物：国王 + 首相。",
    "角色位依据：王国政体下国王=元首、首相=执政者，为最稳定核心组合；内政原文未展开（待推演），先落元首+行政骨架。",
    "人物来源策略：现实优先（D-20260811-014）——可沿用并适配现实人物。",
    "具体人名与任职在 T-038 执行期落表；反对派等留待内政推演阶段。"
  ],
  "supersedes": [],
  "affected_files": [
    "设定书/10-命名卷.md",
    "设定书/11-政权清单.md"
  ]
}
