{
  "schema_version": 1,
  "decision_id": "D-20260812-009",
  "title": "T-009 工厂换算基准：全球 2000 + 提升建筑槽上限（工具类 mod 参考）",
  "status": "confirmed",
  "confirmed_by": "user",
  "confirmed_at": "2026-08-12T02:35:28Z",
  "scope": [
    "economy",
    "factory_conversion",
    "state_buildings"
  ],
  "decisions": [
    "全球民用+军工工厂基准总量 N=2000 左右（不限于原版建筑槽上限）。",
    "各国工厂数 = 2000 × 09 卷工业份额表（第一组+第二组，合计约 88—101%）。",
    "建筑槽上限提升：参考工具类 mod 做法，通过 mod 覆盖 common/state_category（或等效机制）提高槽位上限，使强国（大顺约 150—180 厂）可容纳其工厂配置；不局限原版 megalopolis 12 槽。",
    "槽位提升的实现方式与具体配置值在 T-009 拆解中进一步细化，产出 协作/state-overrides/经济与工业.json 及必要的 mod 覆盖文件。"
  ],
  "supersedes": [],
  "affected_files": [
    "协作/state-overrides/经济与工业.json",
    "mod/",
    "协作/tasks.json",
    "任务书/T-009.json"
  ]
}
