{
  "schema_version": 1,
  "decision_id": "D-20260812-060",
  "title": "T-038人物选用规范（以真实身世制造可信度，以架空经历制造错位感）",
  "status": "confirmed",
  "confirmed_by": "user",
  "confirmed_at": "2026-08-12T22:20:00Z",
  "scope": [
    "T-038",
    "character_design"
  ],
  "decisions": [
    "总纲：以真实身世制造可信度，以架空经历制造错位感；名人负责识别，边缘人物负责历史。",
    "优先真人，不优先名人：姓名/出生年份/出生地/家庭出身保持现实不变；成年后的教育、职业、政治立场、军事经历、官职与最终命运可大幅改写。",
    "名人只做锚点，边缘人物做主体：每国约 30% 知名人物、50% 二三线人物、20% 冷僻或现实边缘人物；孙中山/丘吉尔/列宁/凯末尔/罗斯福类人物不得占满舞台。",
    "错位必须有根：玩家查现实生平后能发现其本就有相关地域/职业/家庭/思想/教育背景，只是现实中未走上这条路。",
    "保留身世，重写成年史：出生于纽约者仍出生纽约、长州者仍出生长州、波兰犹太家庭/广东士绅家庭/德州律师家庭等基础身份不改；世界线改变的是后来成为什么人。",
    "避免现实职位机械平移：现实总统不必仍当总统、元帅不必仍当元帅；现实记者/教授/地方议员/少校/工会干部/企业家可成为首相、革命领袖或名将。",
    "优先选择历史失败者与被结构压制者：现实因政变失败、派系失势、国家灭亡、民族问题、丑闻、早逝、时代不合而未上最高舞台者优先。",
    "人物选择服从本世界制度：先定国家政治结构/意识形态/阶级矛盾/军事制度，再挑人；如德国工程—契约国家多选技术官僚、法学家、铁路军人。",
    "不搬现实左右光谱：现实社会主义者可成宗教社会主义者/联邦主义者/国家改革派，现实保皇派可成现代宪政理论家；思想转变须在本世界成立。",
    "核心性格可保留，政治结论可改：如韦伯重理性化与国家能力、罗斯福重行动主义、张謇重地方实业与教育。",
    "军人强调地域与军校路径：出生地/阶层/现实军事才能保留，所属国家/军种/派系/战争经历可完全不同；日本尤其适合把现实明治将领拆散到幕府、萨摩、长州等势力。",
    "思想家/记者/学者大量使用：教授、报人、律师、宗教人士、工会领袖、企业家进入顾问/理论家/部长/路线领袖池。",
    "A级人物不应天然强于冷门人物：名人作用是帮助玩家识别世界；真正优秀的国策路线可让现实默默无闻者成为本世界时代巨人。",
    "沿用 D-20260811-014 框架：完全架空或历史大变政权（新瀛、日本列岛傀儡幕府等）仍可用虚构人物，但规范第 11 条允许日本列岛优先错位使用现实明治将领。"
  ],
  "supersedes": [],
  "affected_files": [
    "设定书/10-命名卷.md",
    "任务书/R-004-领导人/T-038.json"
  ]
}
