{
  "schema_version": 1,
  "decision_id": "D-20260812-044",
  "title": "T-038法属北美2位核心人物确认",
  "status": "confirmed",
  "confirmed_by": "user",
  "confirmed_at": "2026-08-12T18:20:00Z",
  "scope": [
    "T-038",
    "character_design"
  ],
  "decisions": [
    "法属北美 2 位核心人物：总督 + 民兵军官。",
    "角色位依据：总督=革命海外延续的共和治理代表，民兵军官=共和国民兵体系的军事支柱；覆盖殖民地治理与军事双线，突出革命延续特色。",
    "人物来源策略：现实优先（D-20260811-014）——可沿用并适配现实人物。",
    "具体人名与任职在 T-038 执行期落表；农场主/商人代表留待北美主题阶段。"
  ],
  "supersedes": [],
  "affected_files": [
    "设定书/10-命名卷.md",
    "设定书/11-政权清单.md"
  ]
}
