{
  "schema_version": 1,
  "decision_id": "D-20260812-037",
  "title": "T-038多瑙联邦2位核心人物确认",
  "status": "confirmed",
  "confirmed_by": "user",
  "confirmed_at": "2026-08-12T17:10:00Z",
  "scope": [
    "T-038",
    "character_design"
  ],
  "decisions": [
    "多瑙联邦 2 位核心人物：联邦元首 + 议会议长。",
    "角色位依据：联邦元首=中央执行首脑，议会议长=多民族议会博弈的枢纽，承载多民族联邦（联邦现代性）与身份政治最复杂的定位。",
    "人物来源策略：现实优先（D-20260811-014）——可沿用并适配现实人物。",
    "具体人名与任职在 T-038 执行期落表；成员邦代表（匈牙利/捷克领袖等）留待主题阶段，不占 2 位核心。"
  ],
  "supersedes": [],
  "affected_files": [
    "设定书/10-命名卷.md",
    "设定书/11-政权清单.md"
  ]
}
