{
  "schema_version": 1,
  "decision_id": "D-20260812-042",
  "title": "T-038波斯王国2位核心人物确认",
  "status": "confirmed",
  "confirmed_by": "user",
  "confirmed_at": "2026-08-12T18:00:00Z",
  "scope": [
    "T-038",
    "character_design"
  ],
  "decisions": [
    "波斯王国 2 位核心人物：国王 + 宰相。",
    "角色位依据：国王=元首，宰相=多方平衡外交与现代化改革的核心执行者；契合利用列强竞争（英/俄/顺/德）实现现代化的主线。",
    "人物来源策略：现实优先（D-20260811-014）——可沿用并适配现实人物。",
    "具体人名与任职在 T-038 执行期落表；教界与军界留待波斯主题阶段。"
  ],
  "supersedes": [],
  "affected_files": [
    "设定书/10-命名卷.md",
    "设定书/11-政权清单.md"
  ]
}
