{
  "schema_version": 1,
  "decision_id": "D-20260811-005",
  "title": "完整恢复interview-me模糊需求收束规则",
  "status": "confirmed",
  "confirmed_by": "user",
  "confirmed_at": "2026-08-11T03:17:29Z",
  "scope": [
    "workflow",
    "requirements_interview",
    "cross_tool_protocol"
  ],
  "decisions": [
    "在跨工具中立决策协议中完整恢复原interview-me的模糊需求澄清与收束规则",
    "首次澄清声明假设与置信度，低于约70%时说明缺失信息；每个后续问题都附当前猜测及理由",
    "遇到可扩展、现代、最佳实践等应然性或惯例性回答时追问用户不需向任何人证明时真正想要什么",
    "使用目标、使用者、为何现在、成功标准、约束、不包含六字段完成最终重述",
    "whatever you think、sounds good、sure lets go、沉默后要求开工等弱确认不得视为终态确认",
    "只有能预测用户对接下来三个问题的反应时才满足约95%停止检查；多轮仍无法预测时报告基础信息缺失并请求退一步",
    "中立协议仍是唯一权威，OpenCode namespaced skill只引用协议而不复制规则"
  ],
  "supersedes": [],
  "affected_files": [
    "协作/决策协议.md",
    ".opencode/skills/teg-interview-me/SKILL.md",
    "scripts/workflow.py",
    "tests/test_workflow.py",
    "协作/README.md",
    "docs/协作框架.md",
    "协作/tasks.json",
    "协作/任务台账.md",
    "协作/决策记录/"
  ]
}
