{
  "schema_version": 1,
  "decision_id": "D-20260812-061",
  "title": "T-038 20国具体领导人人物表（整表确认，人物选用规范D-060执行）",
  "status": "confirmed",
  "confirmed_by": "user",
  "confirmed_at": "2026-08-12T23:30:00Z",
  "scope": [
    "T-038",
    "character_design"
  ],
  "decisions": [
    "大顺帝国 3 人（虚构）：泰和帝李炜（约1860—1910，开局暴毙）、李垣（约1880s生，良家子军事贵族，军方拥立对象）、李埏（约1880s生，海商资本集团）。",
    "日本列岛 2 人：德川家达（1863生，田安家→宗家，傀儡将军，继承自隐退庆喜）+ 毛利元昭（1865生萩，长州藩主，1897袭家督；现实公爵书法家→本世界最强藩实权藩主）。",
    "大英帝国 3 人：爱德华七世（1910年初在位数月后病逝）+ 劳合·乔治（现实1910财相→本世界首相，错位提前）+ 博纳·劳（现实1911才任保守党领袖→本世界已任，反对派）。",
    "法兰西共和国 3 人：法利埃（总统）+ 饶勒斯（现实遇刺和平主义社会党领袖→本世界存活入阁任总理，历史失败者错位）+ 福煦（现实圣西尔军校校长→本世界军队强人）。",
    "德意志帝国 3 人：威廉二世（皇帝）+ 韦伯（思想家入阁任宰相，工程—契约国家）+ 伯恩施坦（现实被主流社民党边缘化的修正主义理论家→本世界议会反对派领袖）。",
    "俄罗斯帝国 3 人：尼古拉二世（沙皇）+ 斯托雷平（权臣，现实1910在任，遇刺改革者）+ 萨佐诺夫（外交重臣，现实1910年9月才上任→本世界提前，主推转向欧洲—中亚—高加索）。",
    "奥斯曼联邦帝国 3 人：哈米德二世（现实1909被废→本世界改革帝国中仍为苏丹；隐含本世界青年土耳其党未夺权）+ 塔拉特帕夏（现实1910内政部长→本世界大维齐尔）+ 教界领袖（现实1910年谢赫伊斯兰，待查证后落名）。",
    "多瑙联邦 2 人：斐迪南（现实遇刺储君→本世界已继位联邦元首，弗朗茨·约瑟夫寿数改写）+ 马萨里克（现实布拉格大学教授/帝国议会议员→本世界多民族联邦议长）。",
    "西班牙联邦王国 2 人：阿方索十三世（国王）+ 伊格莱西亚斯（现实1910年1月当选首位西班牙社会主义议员→本世界联邦议会议长，被压制者错位）。",
    "意大利 2 人：埃马努埃莱三世（国王）+ 索尼诺（首相，现实1910年1月在任）。",
    "瑞典—挪威 2 人：古斯塔夫五世（联合国王，本世界1905挪威独立未发生）+ 奥斯卡·卡尔亲王（瑞典王室，挪威副王）。",
    "英属印度 2 人：明托勋爵（总督，现实在任）+ 海得拉巴尼扎姆马布卜·阿里汗（大土邦代表，现实最大土邦君主）。",
    "波斯王国 2 人：艾哈迈德沙（现实1910年12岁幼主，立宪革命后即位，摄政格局）+ 宰相（现实1910年首相，待查证后落名）。",
    "英属北美自治领 2 人：格雷伯爵（总督，现实加拿大总督在任）+ 摩根（现实金融巨头→本世界十三州未独立故为英属北美金融巨头，身世保真命运重写）。",
    "法属北美 2 人：总督（现实法国激进共和派政治家，待查证后落名）+ 民兵军官（现实路易斯安那法语区人物，待查证后落名）。",
    "新瀛 2 人：总督（虚构，大顺行省督抚）+ 海商领袖（错位现实华人企业家，待查证后落名；须注意新瀛顺人为数百年前移民后裔的时代适配）。",
    "美国 3 人：总统（虚构）+ 麦克阿瑟（现实1880生于阿肯色小岩城——本世界美国领土→边疆共和国军统帅，错位有根）+ 边疆领袖（现实德州人物，待查证后落名）。",
    "墨西哥共和国 2 人：迪亚斯（总统，现实1910在任80岁，本世界改革型执政/面临革命危机）+ 奥夫雷贡（现实北方革命军将领→本世界北部军团司令，错位有根）。",
    "巴西帝国 2 人：伊莎贝尔女皇（现实1889被废帝国继承人→本世界1891继位女皇，被压制者错位；佩德罗二世1891逝寿数保真）+ 工会领袖（现实1910年巴西工人运动人物，待查证后落名）。",
    "拉普拉塔联邦 2 人：阿尔科塔（总统，现实1910年在任）+ 乌里布鲁（现实未来1930政变军人、德国军事教育背景→本世界德式工程陆军参谋长，错位有根）。",
    "待查证 7 项（教界领袖/波斯宰相/法属北美总督/法属北美民兵/新瀛海商/美国边疆领袖/巴西工会领袖）落表时标注待查证，后续单独决策补名。"
  ],
  "supersedes": [
    "D-20260812-046"
  ],
  "affected_files": [
    "设定书/10-命名卷.md",
    "设定书/11-政权清单.md"
  ]
}
