{
  "schema_version": 1,
  "decision_id": "D-20260811-019",
  "title": "阶段0先行：先验证现有 states 管线闭环，再扩展州界重划",
  "status": "confirmed",
  "confirmed_by": "user",
  "confirmed_at": "2026-08-11T09:58:00Z",
  "scope": [
    "execution_order",
    "phase0",
    "machine_a"
  ],
  "decisions": [
    "阶段 0 先行：机器 A 登记（env-check --publish）+ 快照导出（按 D-20260811-018 新 schema 一次到位）+ 最小任务书层 + 东亚声明任务（T-020）+ 受控生成（T-028）闭环。",
    "阶段 1（州界重划：provinces 字段、全局唯一归属校验器、state-build 两阶段化）以阶段 0 验收结果为基线，扩展提交以阶段 0 的验收 commit 为 base。",
    "快照导出按 D-20260811-018 新 schema 直接一次到位，不在阶段 0 先导出 v1 再升级，避免重复返工。",
    "故障定位原则：阶段 0 暴露的缺陷视为管线缺陷优先排查，阶段 1 扩展缺陷单独隔离。"
  ],
  "supersedes": [],
  "affected_files": [
    "协作/tasks.json",
    "协作/任务台账.md",
    "协作/README.md"
  ]
}
